{
  "$schema": "./persona.schema.json",
  "timeZone": "Europe/Berlin",
  "ordersPerWeek": 1,
  "windows": ["Sat-Sun 09:00-18:00"],
  "customer": {
    "firstName": "Jonas",
    "lastName": "Weber",
    "email": "jonas.weber@example.com",
    "phone": "+49 40 5550 8811"
  },
  "stores": {
    "de": {
      "id": "d2a94f1c-7e3b-4c8d-9a60-b1e2f3a4c5d6",
      "name": "Nordic Bikes Germany (EUR)",
      "carrier": "UPS",
      "shippingFee": {
        "name": "Shipping, UPS",
        "unitPrice": 990,
        "taxRate": 0
      }
    }
  },
  "addresses": {
    "home": {
      "firstName": "Jonas",
      "lastName": "Weber",
      "streetAddress": "Isestraße 63",
      "postalCode": "20149",
      "city": "Hamburg",
      "country": "DE"
    },
    "gift": {
      "firstName": "Greta",
      "lastName": "Weber",
      "streetAddress": "Am Stadtpark 9",
      "postalCode": "81243",
      "city": "München",
      "country": "DE"
    }
  }
}
