{
  "$schema": "./persona.schema.json",
  "timeZone": "Europe/Stockholm",
  "ordersPerWeek": 28,
  "windows": ["Mon-Sun 20:00-08:00"],
  "customer": {
    "firstName": "Elin",
    "lastName": "Sjöberg",
    "email": "elin.sjoberg@example.com",
    "phone": "+46 18 555 027 41"
  },
  "stores": {
    "se1": {
      "id": "b2e4d8f3-5c6e-4d9b-8f21-3a7c8e9d0b15",
      "name": "Rayon Rhapsody (SEK)",
      "carrier": "PostNord",
      "shippingFee": {
        "name": "Shipping, PostNord",
        "unitPrice": 4900,
        "taxRate": 2500
      }
    },
    "se2": {
      "id": "b2e4d8f3-5c6e-4d9b-8f21-3a7c8e9d0b19",
      "name": "Button Bazaar (SEK)",
      "carrier": "PostNord",
      "shippingFee": {
        "name": "Shipping, PostNord",
        "unitPrice": 4900,
        "taxRate": 2500
      }
    },
    "se3": {
      "id": "b2e4d8f3-5c6e-4d9b-8f21-3a7c8e9d0b04",
      "name": "Moss & Mirror (SEK)",
      "carrier": "PostNord",
      "shippingFee": {
        "name": "Shipping, PostNord",
        "unitPrice": 4900,
        "taxRate": 2500
      }
    }
  },
  "addresses": {
    "home": {
      "firstName": "Elin",
      "lastName": "Sjöberg",
      "streetAddress": "Svartbäcksgatan 21",
      "postalCode": "753 33",
      "city": "Uppsala",
      "country": "SE"
    },
    "work": {
      "firstName": "Elin",
      "lastName": "Sjöberg",
      "company": "Uppsala Nattvård AB",
      "streetAddress": "Dag Hammarskjölds väg 14",
      "postalCode": "751 85",
      "city": "Uppsala",
      "country": "SE"
    }
  }
}
