{
  "$schema": "./persona.schema.json",
  "timeZone": "Europe/Helsinki",
  "ordersPerWeek": 3,
  "windows": ["Mon-Sun 22:00-03:00"],
  "customer": {
    "firstName": "Mikko",
    "lastName": "Laine",
    "email": "mikko.laine@example.com"
  },
  "stores": {
    "fi1": {
      "id": "b2e4d8f3-5c6e-4d9b-8f21-3a7c8e9d0b10",
      "name": "Plaid Parade (EUR)",
      "carrier": "Posti",
      "shippingFee": {
        "name": "Shipping, Posti",
        "unitPrice": 590,
        "taxRate": 2550
      }
    },
    "fi2": {
      "id": "b2e4d8f3-5c6e-4d9b-8f21-3a7c8e9d0b11",
      "name": "Wool Whisper (EUR)",
      "carrier": "Posti",
      "shippingFee": {
        "name": "Shipping, Posti",
        "unitPrice": 590,
        "taxRate": 2550
      }
    },
    "fi3": {
      "id": "b2e4d8f3-5c6e-4d9b-8f21-3a7c8e9d0b20",
      "name": "Zipper Zenith (EUR)",
      "carrier": "Posti",
      "shippingFee": {
        "name": "Shipping, Posti",
        "unitPrice": 590,
        "taxRate": 2550
      }
    }
  },
  "addresses": {
    "home": {
      "firstName": "Mikko",
      "lastName": "Laine",
      "streetAddress": "Kalliolanrinne 7 B 12",
      "postalCode": "00510",
      "city": "Helsinki",
      "country": "FI"
    }
  }
}
