{
  "$schema": "./persona.schema.json",
  "timeZone": "Europe/Berlin",
  "ordersPerWeek": 28,
  "windows": ["Mon-Sun 08:00-20:00"],
  "customer": {
    "firstName": "Felix",
    "lastName": "Brandt",
    "email": "felix.brandt@example.com",
    "phone": "+49 221 5550 3318"
  },
  "stores": {
    "de1": {
      "id": "b2e4d8f3-5c6e-4d9b-8f21-3a7c8e9d0b17",
      "name": "Thimble & Thyme (EUR)",
      "carrier": "DPD",
      "shippingFee": {
        "name": "Shipping, DPD",
        "unitPrice": 590,
        "taxRate": 1900
      }
    },
    "de2": {
      "id": "b2e4d8f3-5c6e-4d9b-8f21-3a7c8e9d0b06",
      "name": "Cobalt Closet (EUR)",
      "carrier": "DPD",
      "shippingFee": {
        "name": "Shipping, DPD",
        "unitPrice": 590,
        "taxRate": 1900
      }
    }
  },
  "addresses": {
    "home": {
      "firstName": "Felix",
      "lastName": "Brandt",
      "streetAddress": "Körnerstraße 37",
      "postalCode": "50823",
      "city": "Köln",
      "country": "DE"
    },
    "workshop": {
      "firstName": "Felix",
      "lastName": "Brandt",
      "company": "Brandt Radservice",
      "streetAddress": "Venloer Straße 412",
      "postalCode": "50825",
      "city": "Köln",
      "country": "DE"
    }
  }
}
