{
  "$schema": "./persona.schema.json",
  "timeZone": "Europe/Berlin",
  "ordersPerWeek": 2,
  "windows": ["Mon-Fri 19:00-23:00", "Sat 10:00-14:00"],
  "customer": {
    "firstName": "Lena",
    "lastName": "Vogt",
    "email": "lena.vogt@example.com",
    "phone": "+49 30 5550 1427"
  },
  "stores": {
    "de1": {
      "id": "b2e4d8f3-5c6e-4d9b-8f21-3a7c8e9d0b18",
      "name": "Satin Sparrow (EUR)",
      "carrier": "DHL",
      "shippingFee": {
        "name": "Shipping, DHL",
        "unitPrice": 490,
        "taxRate": 1900
      }
    },
    "de2": {
      "id": "b2e4d8f3-5c6e-4d9b-8f21-3a7c8e9d0b05",
      "name": "Gingham Galaxy (EUR)",
      "carrier": "DHL",
      "shippingFee": {
        "name": "Shipping, DHL",
        "unitPrice": 490,
        "taxRate": 1900
      }
    },
    "de3": {
      "id": "b2e4d8f3-5c6e-4d9b-8f21-3a7c8e9d0b06",
      "name": "Cobalt Closet (EUR)",
      "carrier": "DHL",
      "shippingFee": {
        "name": "Shipping, DHL",
        "unitPrice": 490,
        "taxRate": 1900
      }
    }
  },
  "addresses": {
    "home": {
      "firstName": "Lena",
      "lastName": "Vogt",
      "streetAddress": "Lindenweg 4",
      "postalCode": "10115",
      "city": "Berlin",
      "country": "DE"
    }
  }
}
